,BasisOfRec,Binomial,CatalogNo,Citation,CollectID,Compiler,Data_sens,Dec_Lat,Dec_Long,Dist_comm,Event_Year,Origin,Presence,Seasonal,Sens_comm,SpatialRef,YrCompiled,recordedBy
1797,PRESERVED_SPECIMEN,Ardisia dunlapiana,3110214,GBIF,695,Manuel Vargas,,8.475,-83.59200000000001,Parque Nacional Corcovado Pavo Forest.,1988.0,1,1,1,,WGS84,2019,C. Kernan
1819,PRESERVED_SPECIMEN,Ardisia dunlapiana,3149111,GBIF,16974,Manuel Vargas,,8.67,-83.57,"Reserva Forestal Golfo Dulce Osa Península, Rancho Quemado, ca.15 km W of Rincón; in bottom of S end of valley along Río Riyito.",1988.0,1,1,1,,WGS84,2019,"B. Hammel, G. Herrera, M. Chavarría & A. Solis"
2324,PRESERVED_SPECIMEN,Ardisia dunlapiana,214205,GBIF,5274,Manuel Vargas,,8.69,-83.48,"Vicinity of Esquinas Experiment Station, sea level",1949.0,1,1,1,,WGS84,2019,P. H. Allen
2370,PRESERVED_SPECIMEN,Ardisia dunlapiana,01282061,GBIF,12189,Manuel Vargas,,8.6717,-83.5047,"Distrito: Sierpe.  Reserva Forestal Golfo Dulce; Rincón, cerca de Banegas Los Charcos, 1 km. al Este del centro del pueblo Banegas, Estación Biológica Los Charcos de Osa",2009.0,1,1,1,,WGS84,2019,R. Aguilar
3296,PRESERVED_SPECIMEN,Ardisia dunlapiana,JACQ-ID 1270342,GBIF,,Manuel Vargas,,8.70083,-83.20167,"Costa Rica, Puntarenas Province, Canton Golfito. Garden of Field Station La Gamba.",2016.0,1,1,1,,WGS84,2019,"Berger,A."
3768,PRESERVED_SPECIMEN,Ardisia dunlapiana,0024754,GBIF,,Manuel Vargas,,8.68333,-83.21667,Golfito. P.N. Piedras Blancas. Way from La Gamba to Golfito.,2000.0,1,1,1,,WGS84,2019,"Huber,W. & Weissenhofer,A."
4292,PRESERVED_SPECIMEN,Ardisia dunlapiana,402173,GBIF,Marín Alpízar 107,Manuel Vargas,,8.68,-83.56,"Rancho Quemado, Estación Forestal, Finca Eloy Cubero",1991.0,1,1,1,,WGS84,2019,Juan Marín
4294,PRESERVED_SPECIMEN,Ardisia dunlapiana,402033,GBIF,Hammel 16974,Manuel Vargas,,8.66,-83.56,"Reserva Forestal Golfo Dulce Osa Península, Rancho Quemado, ca. 15 km W of Rincón; in bottom of S end of valley along Río Riyito.",1988.0,1,1,1,,WGS84,2019,Barry E. Hammel|Gerardo Herrera Ch.|María Marta Chavarría|Ángel Solís
4307,PRESERVED_SPECIMEN,Ardisia dunlapiana,401542,GBIF,Kernan 1216,Manuel Vargas,,8.46,-83.58,"Parque Nacional Corcovado Sirena, Los Patos Forest",1989.0,1,1,1,,WGS84,2019,Christopher Kernan
4394,PRESERVED_SPECIMEN,Ardisia dunlapiana,902784,GBIF,Segura Castillo 93,Manuel Vargas,,8.76,-83.25,"P.N. Corcovado; Valle de Coto Colorado. Estación Esquinas, sendero a la Calathea",1993.0,1,1,1,,WGS84,2019,Marianela Segura|F. J. Quesada
4891,PRESERVED_SPECIMEN,Ardisia dunlapiana,402807,GBIF,Kernan 695,Manuel Vargas,,8.45,-83.55,Parque Nacional Corcovado Pavo Forest. Poorly drained lowland forest.,1988.0,1,1,1,,WGS84,2019,Christopher Kernan
5813,PRESERVED_SPECIMEN,Ardisia dunlapiana,1472102,GBIF,Allen 5274,Manuel Vargas,,8.69,-83.48,Vicinity of Esquinas Experimnet Station.,1949.0,1,1,1,,WGS84,2019,Paul H. Allen
6120,PRESERVED_SPECIMEN,Ardisia dunlapiana,100723583,GBIF,Aguilar Fernández 565,Manuel Vargas,,8.7,-83.5833,Reserva Forestal Golfo Dulce Rancho Quemado. Tierra de los conservacionistas de Rancho,1991.0,1,1,1,,WGS84,2019,Reinaldo Aguilar
6147,PRESERVED_SPECIMEN,Ardisia dunlapiana,100721687,GBIF,Segura Castillo 189,Manuel Vargas,,8.7667,-83.25,"""Parque Nacional Corcovado, Valle de Coto Colorado, alrededores de la Estación Esquinas""",1993.0,1,1,1,,WGS84,2019,Marianela Segura
6148,PRESERVED_SPECIMEN,Ardisia dunlapiana,100721686,GBIF,Segura Castillo 148,Manuel Vargas,,8.7667,-83.25,"""Parque Nacional Corcovado, Valle de Coto Colorado, Estación Esquinas. Sección Esquinas""",1993.0,1,1,1,,WGS84,2019,Marianela Segura
6151,PRESERVED_SPECIMEN,Ardisia dunlapiana,100721688,GBIF,Thomsen 1056,Manuel Vargas,,8.7,-83.5167,"""Osa Peninsula, Aguabuena, 3.5 km W of Rincón, at trail N of the house of don Quecho, W of BOSCOSA station""",1994.0,1,1,1,,WGS84,2019,Karsten Thomsen
6159,PRESERVED_SPECIMEN,Ardisia dunlapiana,100694863,GBIF,Aguilar Fernández 3265,Manuel Vargas,,8.821660000000001,-83.18966,"""Fila Costeña, Fila Cruces Cabeceras del Río Piedras Blancas""",1994.0,1,1,1,,WGS84,2019,Reinaldo Aguilar
6178,PRESERVED_SPECIMEN,Ardisia dunlapiana,100693672,GBIF,Aguilar Fernández 6634,Manuel Vargas,,8.73333,-83.436,"""Distrito Sierpe, Reserva Forestal Golfo Dulce, Mogos, a 33 km de Chacarita, entrada San Luis ca. de la Quebrada Chal, finca de Isidro Mora""",2001.0,1,1,1,,WGS84,2019,Reinaldo Aguilar
6179,PRESERVED_SPECIMEN,Ardisia dunlapiana,100693640,GBIF,Aguilar Fernández 12189,Manuel Vargas,,8.671660000000001,-83.50466,"""Distrito Sierpe, Reserva Forestal Golfo Dulce, Rincón, cerca de Banegas Los Charcos, 1 km al Este del centro del pueblo Banegas, Estacuión Biológica Los Charcos de Osa""",2009.0,1,1,1,,WGS84,2019,Reinaldo Aguilar
6182,PRESERVED_SPECIMEN,Ardisia dunlapiana,100692322,GBIF,Harmon 242,Manuel Vargas,,8.66083,-83.71383,"""Reserva Forestal Golfo Dulce. Península de Osa, Playa Campanario o San Josecito, Sierpe""",1991.0,1,1,1,,WGS84,2019,Patrick K. Harmon
6191,PRESERVED_SPECIMEN,Ardisia dunlapiana,100687542,GBIF,Fletes Almengor 595,Manuel Vargas,,8.75833,-83.26183,"""Parque Nacional Piedras Blancas, Seranías de Golfito, Río Esquinas, Sendero Quebrada Arena""",1998.0,1,1,1,,WGS84,2019,Eida Fletes
6322,PRESERVED_SPECIMEN,Ardisia dunlapiana,100475009,GBIF,Aguilar Fernández 6634,Manuel Vargas,,8.75,-83.434722,"Distrito Sierpe.  Reserva Forestal Golfo Dulce; Mogos, a 33 km de Chacarita Entrada de San Luis, fin del camino, antes de llegar a la finca de Luis Miejia.",2001.0,1,1,1,,WGS84,2019,Reinaldo Aguilar
7315,PRESERVED_SPECIMEN,Ardisia dunlapiana,3418919,GBIF,,Manuel Vargas,,8.662222,-83.199722,"La Montura, Sendero La Gamba.",2000.0,1,1,1,,WGS84,2019,L. Acosta; Gerardo Soto ; Geovanny Sancho
7316,PRESERVED_SPECIMEN,Ardisia dunlapiana,3418918,GBIF,,Manuel Vargas,,8.662222,-83.199722,"La Montura, Sendero La Gamba.",2000.0,1,1,1,,WGS84,2019,L. Acosta; Gerardo Soto ; Geovanny Sancho
7317,PRESERVED_SPECIMEN,Ardisia dunlapiana,3418916,GBIF,,Manuel Vargas,,8.662222,-83.199722,"La Montura, Sendero La Gamba.",2000.0,1,1,1,,WGS84,2019,L. Acosta; Gerardo Soto ; Geovanny Sancho
7318,PRESERVED_SPECIMEN,Ardisia dunlapiana,3418917,GBIF,,Manuel Vargas,,8.662222,-83.199722,"La Montura, Sendero La Gamba.",2000.0,1,1,1,,WGS84,2019,L. Acosta; Gerardo Soto ; Geovanny Sancho
7442,PRESERVED_SPECIMEN,Ardisia dunlapiana,3099254,GBIF,,Manuel Vargas,,8.758458000000001,-83.262222,P.N. Piedras Blancas. Río Esquinas.  Sendero a quebrada Arena.,1998.0,1,1,1,,WGS84,2019,Eida Fletes
7443,PRESERVED_SPECIMEN,Ardisia dunlapiana,3099253,GBIF,,Manuel Vargas,,8.758458000000001,-83.262222,P.N. Piedras Blancas. Río Esquinas.  Sendero a quebrada Arena.,1998.0,1,1,1,,WGS84,2019,Eida Fletes
7444,PRESERVED_SPECIMEN,Ardisia dunlapiana,3099252,GBIF,,Manuel Vargas,,8.758458000000001,-83.262222,P.N. Piedras Blancas. Río Esquinas.  Sendero a quebrada Arena.,1998.0,1,1,1,,WGS84,2019,Eida Fletes
7445,PRESERVED_SPECIMEN,Ardisia dunlapiana,3099255,GBIF,,Manuel Vargas,,8.758458000000001,-83.262222,P.N. Piedras Blancas. Río Esquinas.  Sendero a quebrada Arena.,1998.0,1,1,1,,WGS84,2019,Eida Fletes
7539,PRESERVED_SPECIMEN,Ardisia dunlapiana,2924457,GBIF,,Manuel Vargas,,8.466667,-83.583338,"Sirena. Sendero Pavo, sector a 50 msnm",1988.0,1,1,1,,WGS84,2019,C. Kernan
7708,PRESERVED_SPECIMEN,Ardisia dunlapiana,2849932,GBIF,,Manuel Vargas,,8.683333,-83.216667,"Fila Gamba, 3 Km NE camino entre Golfito y Villa Briceno.",1997.0,1,1,1,,WGS84,2019,Werner Huber; A. Weissenhofer
7847,PRESERVED_SPECIMEN,Ardisia dunlapiana,1607033,GBIF,,Manuel Vargas,,8.766667,-83.250001,Estacion Esquinas; Seccion Esquinas.,1993.0,1,1,1,,WGS84,2019,Marianella Segura
7848,PRESERVED_SPECIMEN,Ardisia dunlapiana,1607032,GBIF,,Manuel Vargas,,8.766667,-83.250001,Alrededores de la Estacion Esquinas.,1993.0,1,1,1,,WGS84,2019,Marianella Segura
7854,PRESERVED_SPECIMEN,Ardisia dunlapiana,1607019,GBIF,,Manuel Vargas,,8.817222000000001,-83.189722,Fila Cruces Cabeceras del Rio Piedras Blancas.,1994.0,1,1,1,,WGS84,2019,Reinaldo Aguilar
7885,PRESERVED_SPECIMEN,Ardisia dunlapiana,1598616,GBIF,,Manuel Vargas,,8.766667,-83.25,"Estacion Esquinas, sendero a la Calathea",1993.0,1,1,1,,WGS84,2019,Marianella Segura
7889,PRESERVED_SPECIMEN,Ardisia dunlapiana,1598577,GBIF,,Manuel Vargas,,8.466667,-83.583334,"Sirena. Los Patos Forest, 1-50 msnm",1989.0,1,1,1,,WGS84,2019,C. Kernan
7891,PRESERVED_SPECIMEN,Ardisia dunlapiana,1598581,GBIF,,Manuel Vargas,,8.684722,-83.563889,Rancho Quemado. Eston Forestal. Finca Eloy Cubero.,1991.0,1,1,1,,WGS84,2019,Juan Marin
7899,PRESERVED_SPECIMEN,Ardisia dunlapiana,1598532,GBIF,,Manuel Vargas,,8.666667,-83.56666700000001,"Rancho Quemado, ca. 15 km W of Rincon; in bottom of S end of valley along Rio Riyito.",1988.0,1,1,1,,WGS84,2019,Barry Hammel
7900,PRESERVED_SPECIMEN,Ardisia dunlapiana,1598540,GBIF,,Manuel Vargas,,8.660833,-83.713889,Playa Campanario o San Josecito. Sierpe. Primary forest.,1991.0,1,1,1,,WGS84,2019,Patrick Harmon
7913,PRESERVED_SPECIMEN,Ardisia dunlapiana,1598457,GBIF,,Manuel Vargas,,8.7,-83.594445,Rancho Quemado. Tierra de Conservacion.,1991.0,1,1,1,,WGS84,2019,Reinaldo Aguilar
8131,PRESERVED_SPECIMEN,Ardisia dunlapiana,1516734,GBIF,,Manuel Vargas,,8.705556,-83.525,Rincon de Osa. Agua Buena.,1993.0,1,1,1,,WGS84,2019,Karsten Thomsen
8260,PRESERVED_SPECIMEN,Ardisia dunlapiana,V0065761F,GBIF,5274,Manuel Vargas,,10.0,-84.8333,,1949.0,1,1,1,,WGS84,2019,P. H. Allen
8411,PRESERVED_SPECIMEN,Ardisia dunlapiana,G-G-196345/1,GBIF,,Manuel Vargas,,9.97028,-84.18806,Costa Rica,2000.0,1,1,1,,WGS84,2019,"Acosta, L., G. Sancho & G. Soto (Coll. G)"
8436,PRESERVED_SPECIMEN,Ardisia dunlapiana,0026771,GBIF,,Manuel Vargas,,8.68333,-83.21667,"Puntarenas/Golfito; P.N. Piedras Blancas, Bosque Esquinas, Sendero a Valle Bonito. 8°41' N, 83°13' W. Alt. 100 m.",2001.0,1,1,1,,WGS84,2019,"Arauz S.,E.G."
8439,PRESERVED_SPECIMEN,Ardisia dunlapiana,0020876,GBIF,,Manuel Vargas,,8.68333,-83.21667,,2000.0,1,1,1,,WGS84,2019,"Huber,W. & Weissenhofer,A."
8468,PRESERVED_SPECIMEN,Ardisia dunlapiana,S10-39932,GBIF,595,Manuel Vargas,,8.75,-83.25,Flora de Costa Rica. Puntarenas: Golfito. P. N. Piedras Blancas. Serranías de Golfito. Río Esquinas. Sendero Quebrada Arena.,1998.0,1,1,1,,WGS84,2019,E. Fletes
8789,PRESERVED_SPECIMEN,Ardisia dunlapiana,1315,GBIF,,Manuel Vargas,,8.685,-82.923167,,,1,1,1,,WGS84,2019,
9511,PRESERVED_SPECIMEN,Ardisia dunlapiana,132450,GBIF,,Manuel Vargas,,8.766667,-83.25,"P. N. Corcovado, S. Esquinas Golfito Golfo Dulce ca. Rio Esquinas Estacion Esquinas, sendero a la Calathea",1993.0,1,1,1,,WGS84,2019,M. Segura
9512,PRESERVED_SPECIMEN,Ardisia dunlapiana,132449,GBIF,,Manuel Vargas,,8.766667,-83.25,Canton de GOLFITO P.N. Corcovado Valle de Coto Colorado. Estacion Esquinas: Section Esquinas.,1993.0,1,1,1,,WGS84,2019,M. Segura
9513,PRESERVED_SPECIMEN,Ardisia dunlapiana,132448,GBIF,,Manuel Vargas,,8.817222000000001,-83.189722,Canton de Golfito. Fila Costeña. Fila Cruces Cabecerasd del rio Piedras Blancas.,1994.0,1,1,1,,WGS84,2019,R. Aguilar
9549,PRESERVED_SPECIMEN,Ardisia dunlapiana,106260,GBIF,,Manuel Vargas,,8.45,-83.55,Parque Nacional Corcovado Pavo Forest.,1988.0,1,1,1,,WGS84,2019,C. N. Kernan
9873,PRESERVED_SPECIMEN,Ardisia dunlapiana,232592,GBIF,,Manuel Vargas,,8.68,-83.21,"P. N. Piedras Blancas P.N.Piedras Blancas, way from La Gamba to Golfito.",2000.0,1,1,1,,WGS84,2019,"Huber, Werner"
9876,PRESERVED_SPECIMEN,Ardisia dunlapiana,213985,GBIF,,Manuel Vargas,,8.68,-83.21,"Parque Nacional Cuatro Esquinas, Sección Bosque de los Austriacos, W on the way from Sendero Bajaro to the Fila-way",1998.0,1,1,1,,WGS84,2019,"Huber, Werner"
9891,PRESERVED_SPECIMEN,Ardisia dunlapiana,185833,GBIF,,Manuel Vargas,,8.68,-83.21,"Bosque de Los Austriacos, Primary forest, reseach plot-La Gamba",1994.0,1,1,1,,WGS84,2019,"Huber, Werner"
9892,PRESERVED_SPECIMEN,Ardisia dunlapiana,185803,GBIF,,Manuel Vargas,,8.68,-83.21,"Bosque de Los Austriacos, Primary forest, reseach plot-La Gamba",1994.0,1,1,1,,WGS84,2019,"Huber, Werner"
9894,PRESERVED_SPECIMEN,Ardisia dunlapiana,179051,GBIF,,Manuel Vargas,,8.71,-83.51,"Aguabuena.3 km W of Rincón. Along trail leading north from the house of Don Quecho, W of BOSCOSA STATION.Tall undistrbed forest in elevated, well drained terrain",1994.0,1,1,1,,WGS84,2019,"Thomsen, Karsten"
10106,UNKNOWN,Ardisia dunlapiana,100113956,GBIF,,Manuel Vargas,,8.68333,-83.2167,"P.N. Piedras Blancas, Bosque Esquinas, Sendero a Valle Bonito",2001.0,1,1,1,,WGS84,2019,Arauz Suarez Eduardo Gerrado
10107,UNKNOWN,Ardisia dunlapiana,100113955,GBIF,,Manuel Vargas,,8.68333,-83.2167,"P.N. Piedras Blancas, Bosque Esquinas, Sendero a Valle Bonito",2001.0,1,1,1,,WGS84,2019,Arauz Suarez Eduardo Gerrado
10108,UNKNOWN,Ardisia dunlapiana,100080932,GBIF,,Manuel Vargas,,8.68333,-83.2167,"P.N. Piedras Blancas, way from La Gamba to Golfito",2000.0,1,1,1,,WGS84,2019,"Huber Werner, Weissenhofer Anton"
10109,UNKNOWN,Ardisia dunlapiana,100080931,GBIF,,Manuel Vargas,,8.68333,-83.2167,"P.N. Piedras Blancas, way from La Gamba to La Bolsa",2000.0,1,1,1,,WGS84,2019,"Huber Werner, Weissenhofer Anton"
10110,UNKNOWN,Ardisia dunlapiana,100080930,GBIF,,Manuel Vargas,,8.68333,-83.2167,"P.N. Piedras Blancas, way from La Gamba to Golfito",2000.0,1,1,1,,WGS84,2019,"Huber Werner, Weissenhofer Anton"
10111,UNKNOWN,Ardisia dunlapiana,100080929,GBIF,,Manuel Vargas,,8.68333,-83.2167,"""Bosque de los Austriacos"", La Gamba, on the way to the research plot",1994.0,1,1,1,,WGS84,2019,"Huber Werner, Weissenhofer Anton"
10112,UNKNOWN,Ardisia dunlapiana,100080928,GBIF,,Manuel Vargas,,8.68333,-83.2167,"Parque Nacional Esquinas ""Bosque de los Austriacos"" on the way from the Sendero Bajaro to the Fila-way",1998.0,1,1,1,,WGS84,2019,"Huber Werner, Weissenhofer Anton"
10113,UNKNOWN,Ardisia dunlapiana,100080927,GBIF,,Manuel Vargas,,8.68333,-83.2167,"""Bosque de los Austriacos"", on the fila next to the research-plot La Gamba",1997.0,1,1,1,,WGS84,2019,"Huber Werner, Weissenhofer Anton"
10114,UNKNOWN,Ardisia dunlapiana,100080926,GBIF,,Manuel Vargas,,8.68333,-83.2167,"P.N. Piedras Blancas, Bosque Esquinas, Sendero a Valle Bonito",2001.0,1,1,1,,WGS84,2019,Arauz Suarez Eduardo Gerrado
